{
  "schemaVersion": 1,
  "attempt": 1,
  "sequence": 3,
  "inputVersionIds": [
    "file_version_short"
  ],
  "resultType": "file_scan",
  "payload": {
    "supportStatus": "rejected",
    "detectedMediaType": "application/pdf",
    "magicBytes": "50",
    "encrypted": false,
    "macroDetected": false,
    "malwareStatus": "clean",
    "rejectionCodes": [
      "FILE_MAGIC_MISMATCH"
    ],
    "checks": [
      {
        "code": "magic_bytes",
        "status": "failed"
      }
    ],
    "tool": {
      "name": "reflo-file-scan",
      "version": "1.0.0"
    },
    "inspectedAt": "2026-07-26T10:00:00+09:00"
  },
  "results": [
    {
      "entityType": "file_scan",
      "entityId": "scan_short",
      "version": 1,
      "hash": "53db6be15603a3de42dc8d8aaeba014f7e3592178db7e4000dcb421b396b4984"
    }
  ],
  "artifacts": [],
  "tool": {
    "name": "reflo-control",
    "version": "1.0.0"
  }
}
